{
    "@context": "https://standards-ontotest.oftrust.net/v2/Schema/Identity/Equipment/Device/Luminaire/",
    "@type": "Luminaire",
    "id": "",
    "data": {
        "electricityPower": "",
        "serialNumber": "",
        "industryDomain": "",
        "lightColorRenderingIndex": "",
        "volume": "",
        "lightDirection": "",
        "length": "",
        "controlMode": "",
        "lampType": "",
        "name": "",
        "height": "",
        "lightVisor": "",
        "idLocal": "",
        "typeName": "",
        "descriptionGeneral": "",
        "connectionMechanism": "",
        "installationType": "",
        "ifcElementType": "",
        "width": "",
        "controlMechanism": "",
        "protectionResilience": "",
        "colorCode": "",
        "weight": "",
        "colorName": "",
        "status": "",
        "thickness": "",
        "categorizationETIM": "",
        "installationTypeAvailable": "",
        "power": "",
        "areaGross": "",
        "ifcElementName": "",
        "categorizationLocal": "",
        "lightFlux": "",
        "ifcGuid": "",
        "areaNet": "",
        "electricityCurrent": "",
        "protectionDegree": "",
        "lightColor": ""
    },
    "metadata": {
        "updatedBy": "",
        "updatedAt": "",
        "createdAt": "",
        "createdBy": ""
    },
    "function": ""
}